"# Generated by write_osm_objects_report from LangToolsOSM 0.0.15 with parameters: lang=ca, extra_tag=('name:ca', 'alt_name:ca', 'alt_name'), area=['name:ca'='Serra de Tramuntana'][admin_level=7], filters=nwr[name~'^[Cc]amino'][!'name:ca']"	""	""	""	""	""	""	""	""	""	""
"typeOSM"	"idOSM"	"name"	"name:ca"	"alt_name:ca"	"alt_name"	"translations"	"ca.wikipedia_page"	"wikidata_id"	"multilang_names"	"all_tags"
"way"	"102255147"	"Camino de Cornellar de Can Font"	""	""	""	""	""	""	""	"{'highway': 'service', 'name': 'Camino de Cornellar de Can Font'}"
"way"	"5229510"	"Camino de La Porrassa"	""	""	""	""	""	""	""	"{'highway': 'residential', 'name': 'Camino de La Porrassa', 'oneway': 'yes'}"
"way"	"26416969"	"Camino de La Porrassa"	""	""	""	""	""	""	""	"{'highway': 'residential', 'name': 'Camino de La Porrassa', 'oneway': 'yes'}"
"way"	"1064751729"	"Camino de Bòquer"	""	""	""	""	""	""	""	"{'landuse': 'residential', 'name': 'Camino de Bòquer', 'residential': 'apartments'}"
