"# Generated by write_osm_objects_report from LangToolsOSM 0.1 with parameters: lang=ca, extra_tag=('name:ca', 'alt_name:ca', 'alt_name'), query=[out:json][timeout:1000]; rel(343021);map_to_area->.municipi; nwr(area.municipi)[name~'^([Aa]vinguda|[Cc]arrer|[Cc]amí|[Pp]arc|[Pp]laça) '][!'name:ca']; out tags qt;"	""	""	""	""	""	""	""	""	""	""	""
"typeOSM"	"idOSM"	"name"	"name:ca"	"alt_name:ca"	"alt_name"	"translations"	"ca.wikipedia_page"	"wikidata_type"	"wikidata_id"	"multilang_names"	"all_tags"
"way"	"452882681"	"camí d'Onda a Artana"	""	""	"Pista de les Penyes Altes o Aragonesses"	""	""	""	""	""	"{'alt_name': 'Pista de les Penyes Altes o Aragonesses', 'alt_name:es': 'Pista de las Peñas Aragonesas o Peñas Altas', 'bicycle': 'yes', 'foot': 'yes', 'highway': 'track', 'horse': 'yes', 'motor_vehicle': 'yes', 'name': ""camí d'Onda a Artana"", 'surface': 'unpaved'}"
"way"	"817720689"	"Camí finca dels ""Merla"""	""	""	""	""	""	""	""	""	"{'bicycle': 'yes', 'highway': 'track', 'horse': 'yes', 'name': 'Camí finca dels ""Merla""', 'surface': 'ground', 'tracktype': 'grade2'}"
"way"	"219233097"	"Camí de la Font de Lloscos"	""	""	""	""	""	""	""	""	"{'highway': 'track', 'name': 'Camí de la Font de Lloscos', 'surface': 'asphalt', 'tracktype': 'grade1'}"
"way"	"461008800"	"Camí de la Llidona"	""	""	"senda de la pedrissa"	""	""	""	""	""	"{'alt_name': 'senda de la pedrissa', 'highway': 'path', 'name': 'Camí de la Llidona'}"
