"# EDITED with R"	""	""	""	""	""	""	""	""	""	""	""
"name"	"name:ca"	"alt_name"	"alt_name:ca"	"translations"	"ca.wikipedia_page"	"wikidata_type"	"wikidata_id"	"typeOSM"	"idOSM"	"multilang_names"	"all_tags"
"Estany de la Roca"	"Estany de la Roca"							"relation"	"2432400"		"{'name': 'Estany de la Roca', 'natural': 'rock', 'type': 'multipolygon'}"
"Estany de Mangades"	"Estany de Mangades"			"Estany de Mangades, estany de Mangades"	"Estany de Mangades"	"glacial lake"	"Q11920885"	"way"	"53772095"	"name:oc=Lac de Margades"	"{'name': 'Estany de Mangades', 'name:oc': 'Lac de Margades', 'natural': 'water', 'water': 'lake', 'wikidata': 'Q11920885', 'wikipedia': 'ca:Estany de Mangades'}"
"Estany del Port de Caldes"	"Estany del Port de Caldes"							"way"	"53772094"	"name:oc=Lac deth Pòrt de Caldes"	"{'name': 'Estany del Port de Caldes', 'name:oc': 'Lac deth Pòrt de Caldes', 'natural': 'water'}"
"Pla de l'Ermita"	"Pla de l'Ermita"							"node"	"1906975398"		"{'bus': 'yes', 'highway': 'bus_stop', 'name': \"Pla de l'Ermita\", 'public_transport': 'platform'}"
"Pla de la Carlina"	"Pla de la Carlina"							"node"	"3994796987"		"{'name': 'Pla de la Carlina', 'place': 'locality'}"
"Pla de la Molina"	"Pla de la Molina"							"node"	"1241627786"		"{'name': 'Pla de la Molina', 'place': 'locality', 'source': 'Instituto Geográfico Nacional', 'source:date': '201011'}"
"Pla de Sallent"	"Pla de Sallent"							"node"	"3706941322"		"{'name': 'Pla de Sallent', 'place': 'locality'}"
