"# EDITED with R"	""	""	""	""	""	""	""	""	""	""	""
"name"	"name:ca"	"alt_name"	"alt_name:ca"	"translations"	"ca.wikipedia_page"	"wikidata_type"	"wikidata_id"	"typeOSM"	"idOSM"	"multilang_names"	"all_tags"
"Ajuntament de Vallirana"	"Ajuntament de Vallirana"							"way"	" 866398265"		"{'amenity': 'townhall', 'building': 'public', 'name': 'Ajuntament de Vallirana'}"
"Bosc de Ca n'Ardenya"	"Bosc de Ca n'Ardenya"							"node"	"8375533566"		"{'name': \"Bosc de Ca n'Ardenya\", 'natural': 'wood'}"
"Mas de les Fonts"	"Mas de les Fonts"							"node"	"3706959344"		"{'name': 'Mas de les Fonts', 'place': 'hamlet'}"
"Mas de les Fonts"	"Mas de les Fonts"							"node"	"8445184579"		"{'name': 'Mas de les Fonts', 'place': 'isolated_dwelling'}"
"Mas de les Fonts"	"Mas de les Fonts"							"way"	" 233258898"		"{'landuse': 'residential', 'name': 'Mas de les Fonts'}"
"Mas Vell del Lledoner"	"Mas Vell del Lledoner"							"node"	"4817564723"		"{'building': 'yes', 'name': 'Mas Vell del Lledoner'}"
