"# EDITED with R"	""	""	""	""	""	""	""	""	""	""	""
"name"	"name:ca"	"alt_name"	"alt_name:ca"	"translations"	"ca.wikipedia_page"	"wikidata_type"	"wikidata_id"	"typeOSM"	"idOSM"	"multilang_names"	"all_tags"
"camí d'Aireflor"	"camí d'Aireflor"							"way"	"  25652266"		"{'highway': 'unclassified', 'name': \"camí d'Aireflor\"}"
"camí d'Aireflor nou"	"camí d'Aireflor nou"							"way"	" 430446563"		"{'highway': 'track', 'name': \"camí d'Aireflor nou\"}"
"Camí d'Arguelletes"	"Camí d'Arguelletes"							"way"	" 970678570"		"{'highway': 'track', 'name': \"Camí d'Arguelletes\"}"
"camí d'es Revellar (TM Sencelles)"	"camí d'es Revellar (TM Sencelles)"							"way"	" 144197318"		"{'highway': 'track', 'name': \"camí d'es Revellar (TM Sencelles)\"}"
"camí d'Establiments"	"camí d'Establiments"							"way"	" 909703315"		"{'highway': 'track', 'name': \"camí d'Establiments\"}"
"camí d'Establiments"	"camí d'Establiments"							"way"	" 208025008"		"{'highway': 'unclassified', 'name': \"camí d'Establiments\"}"
"Camí d'Establiments"	"Camí d'Establiments"							"way"	" 144197323"		"{'highway': 'track', 'name': \"Camí d'Establiments\"}"
"Camí d'Establiments (Sencelles)"	"Camí d'Establiments (Sencelles)"							"node"	"3691504289"		"{'bench': 'no', 'bus': 'yes', 'highway': 'bus_stop', 'name': \"Camí d'Establiments (Sencelles)\", 'network': 'Transports públics de Mallorca', 'operator': 'Consorci de Transports de Mallorca', 'passenger_information_display': 'no', 'public_transport': 'platform', 'ref': '47017', 'route_ref': '310', 'shelter': 'no'}"
"camí d'Inca"	"camí d'Inca"							"way"	"  32606723"		"{'highway': 'unclassified', 'name': \"camí d'Inca\"}"
"camí de Biniagual"	"camí de Biniagual"							"way"	"  83628862"		"{'highway': 'unclassified', 'name': 'camí de Biniagual'}"
"camí de Binialmara"	"camí de Binialmara"							"way"	" 679229717"		"{'bicycle': 'designated', 'bridge': 'yes', 'highway': 'unclassified', 'layer': '1', 'maxspeed': '40', 'name': 'camí de Binialmara', 'source': 'survey', 'surface': 'asphalt'}"
"camí de Binialmara"	"camí de Binialmara"							"way"	"  51907198"		"{'bicycle': 'designated', 'highway': 'unclassified', 'maxspeed': '40', 'name': 'camí de Binialmara', 'source': 'survey', 'surface': 'asphalt'}"
"camí de Binialmara"	"camí de Binialmara"							"way"	" 679229716"		"{'bicycle': 'designated', 'highway': 'unclassified', 'maxspeed': '40', 'name': 'camí de Binialmara', 'source': 'survey', 'surface': 'asphalt'}"
"camí de Binifat"	"camí de Binifat"							"way"	"  61909374"		"{'highway': 'unclassified', 'name': 'camí de Binifat'}"
"camí de Binifuell"	"camí de Binifuell"							"way"	" 230248673"		"{'highway': 'unclassified', 'name': 'camí de Binifuell'}"
"camí de Binissalem"	"camí de Binissalem"							"way"	" 448969622"		"{'highway': 'unclassified', 'name': 'camí de Binissalem', 'surface': 'asphalt'}"
"camí de Ca na Mira"	"camí de Ca na Mira"							"way"	" 487049848"		"{'highway': 'track', 'name': 'camí de Ca na Mira'}"
"Camí de Can Florit"	"Camí de Can Florit"							"way"	"  32391512"		"{'highway': 'unclassified', 'name': 'Camí de Can Florit'}"
"Camí de Can Florit"	"Camí de Can Florit"							"way"	"  32391554"		"{'highway': 'track', 'name': 'Camí de Can Florit'}"
"camí de Can Merris"	"camí de Can Merris"							"way"	" 208025006"		"{'highway': 'unclassified', 'name': 'camí de Can Merris'}"
"camí de Can Ribes"	"camí de Can Ribes"							"way"	" 909596292"		"{'highway': 'track', 'name': 'camí de Can Ribes'}"
"camí de Can Trist"	"camí de Can Trist"							"way"	"  32607118"		"{'highway': 'unclassified', 'name': 'camí de Can Trist', 'source': 'survey'}"
"Camí de Cas Alois"	"Camí de Cas Alois"							"way"	" 304131090"		"{'highway': 'track', 'name': 'Camí de Cas Alois'}"
"camí de Cas Cabo"	"camí de Cas Cabo"							"way"	"  32607327"		"{'highway': 'unclassified', 'name': 'camí de Cas Cabo'}"
"Camí de Consell"	"Camí de Consell"							"way"	"  25315338"		"{'cycleway:both': 'no', 'highway': 'unclassified', 'lane_markings': 'no', 'name': 'Camí de Consell', 'surface': 'asphalt'}"
"camí de Costitx"	"camí de Costitx"							"way"	" 909724247"		"{'highway': 'unclassified', 'name': 'camí de Costitx', 'source': 'survey', 'surface': 'asphalt', 'tracktype': 'grade1'}"
"camí de la Beata"	"camí de la Beata"							"way"	"  83628897"		"{'highway': 'unclassified', 'name': 'camí de la Beata', 'old_name': 'camí de la Venerable', 'source': 'survey', 'surface': 'asphalt', 'tracktype': 'grade1'}"
"camí de la Màniga"	"camí de la Màniga"							"way"	"  55601798"		"{'highway': 'unclassified', 'name': 'camí de la Màniga'}"
"Camí de Lloret a Ruberts"	"Camí de Lloret a Ruberts"							"way"	" 158594200"		"{'highway': 'unclassified', 'name': 'Camí de Lloret a Ruberts', 'surface': 'asphalt'}"
"camí de Montuïri"	"camí de Montuïri"	"camí de Son Campà"	"camí de Son Campà"					"way"	" 198495676"		"{'alt_name': 'camí de Son Campà', 'bicycle': 'designated', 'highway': 'track', 'name': 'camí de Montuïri', 'surface': 'gravel', 'tracktype': 'grade2'}"
"camí de Montuïri"	"camí de Montuïri"							"way"	"  28053870"		"{'highway': 'unclassified', 'name': 'camí de Montuïri', 'source': 'survey', 'surface': 'asphalt'}"
"camí de Montuïri"	"camí de Montuïri"							"way"	" 910513275"		"{'bridge': 'yes', 'highway': 'unclassified', 'layer': '1', 'name': 'camí de Montuïri', 'source': 'survey', 'surface': 'asphalt'}"
"camí de Montuïri"	"camí de Montuïri"							"way"	" 910513274"		"{'highway': 'unclassified', 'name': 'camí de Montuïri', 'source': 'survey', 'surface': 'asphalt'}"
"camí de Montuïri"	"camí de Montuïri"							"way"	"  28054330"		"{'highway': 'unclassified', 'name': 'camí de Montuïri', 'oneway': 'yes', 'surface': 'asphalt'}"
"camí de Montuïri"	"camí de Montuïri"							"way"	"1087668909"		"{'bicycle': 'designated', 'highway': 'track', 'name': 'camí de Montuïri', 'surface': 'asphalt', 'tracktype': 'grade2'}"
"camí de Montuïri"	"camí de Montuïri"							"way"	" 555380994"		"{'highway': 'unclassified', 'name': 'camí de Montuïri', 'source': 'survey', 'surface': 'asphalt'}"
"camí de Morelló"	"camí de Morelló"	"camí de So na Rossa"	"camí de So na Rossa"					"way"	" 473032809"		"{'alt_name': 'camí de So na Rossa', 'highway': 'unclassified', 'name': 'camí de Morelló', 'surface': 'asphalt'}"
"Camí de Morelló"	"Camí de Morelló"							"way"	" 473033021"		"{'highway': 'track', 'name': 'Camí de Morelló'}"
"camí de Morelló nou"	"camí de Morelló nou"							"way"	" 688840536"		"{'access': 'private', 'highway': 'track', 'name': 'camí de Morelló nou'}"
"camí de Morelló vell"	"camí de Morelló vell"							"way"	" 473032817"		"{'access': 'private', 'highway': 'track', 'name': 'camí de Morelló vell'}"
"camí de na Graciana"	"camí de na Graciana"							"way"	"  32607431"		"{'highway': 'unclassified', 'name': 'camí de na Graciana'}"
"camí de na Vilapriu"	"camí de na Vilapriu"							"way"	"  28528059"		"{'highway': 'track', 'name': 'camí de na Vilapriu'}"
"camí de s'Alqueria Roja"	"camí de s'Alqueria Roja"							"way"	" 419525948"		"{'highway': 'unclassified', 'name': \"camí de s'Alqueria Roja\", 'surface': 'asphalt'}"
"camí de s'Alzinar"	"camí de s'Alzinar"							"way"	"  72612332"		"{'highway': 'unclassified', 'name': \"camí de s'Alzinar\"}"
"camí de s'Era Esfondrada"	"camí de s'Era Esfondrada"							"way"	"  32784097"		"{'highway': 'unclassified', 'name': \"camí de s'Era Esfondrada\"}"
"camí de s'Eriçal"	"camí de s'Eriçal"							"way"	" 679228564"		"{'highway': 'track', 'name': \"camí de s'Eriçal\"}"
"camí de s'Eriçal"	"camí de s'Eriçal"							"way"	" 683651583"		"{'highway': 'unclassified', 'name': \"camí de s'Eriçal\"}"
"camí de sa Bassa de Lear"	"camí de sa Bassa de Lear"							"way"	"  32606724"		"{'highway': 'track', 'name': 'camí de sa Bassa de Lear'}"
"camí de sa Bassa de sa Llentia"	"camí de sa Bassa de sa Llentia"							"way"	"  28528058"		"{'highway': 'track', 'name': 'camí de sa Bassa de sa Llentia'}"
"camí de sa Costa"	"camí de sa Costa"							"way"	" 741886406"		"{'cycleway:right': 'no', 'highway': 'unclassified', 'lane_markings': 'no', 'name': 'camí de sa Costa', 'oneway': 'yes', 'surface': 'asphalt'}"
"camí de sa Costa"	"camí de sa Costa"							"way"	" 741886407"		"{'highway': 'unclassified', 'name': 'camí de sa Costa', 'oneway': 'yes', 'surface': 'asphalt'}"
"camí de sa Costa"	"camí de sa Costa"							"way"	"  52982616"		"{'cycleway:right': 'no', 'highway': 'unclassified', 'lane_markings': 'no', 'name': 'camí de sa Costa', 'oneway': 'yes', 'surface': 'asphalt'}"
"camí de sa Rajola"	"camí de sa Rajola"							"way"	"  32607329"		"{'created_by': 'JOSM', 'highway': 'unclassified', 'name': 'camí de sa Rajola'}"
"camí de sa Talaia"	"camí de sa Talaia"							"way"	" 144197317"		"{'highway': 'unclassified', 'name': 'camí de sa Talaia'}"
"camí de ses Ànimes"	"camí de ses Ànimes"							"way"	" 144197324"		"{'highway': 'track', 'name': 'camí de ses Ànimes'}"
"Camí de ses Ànimes (Sencelles)"	"Camí de ses Ànimes (Sencelles)"							"node"	"4810624516"		"{'bench': 'no', 'bus': 'yes', 'highway': 'bus_stop', 'name': 'Camí de ses Ànimes (Sencelles)', 'network': 'Transports públics de Mallorca', 'operator': 'Consorci de Transports de Mallorca', 'passenger_information_display': 'no', 'public_transport': 'platform', 'ref': '47011', 'route_ref': '310', 'shelter': 'no'}"
"Camí de ses Basses"	"Camí de ses Basses"							"way"	"  52982614"		"{'highway': 'unclassified', 'name': 'Camí de ses Basses'}"
"Camí de Ses Comes"	"Camí de Ses Comes"							"way"	" 910500279"		"{'highway': 'track', 'name': 'Camí de Ses Comes'}"
"camí de ses Rotes"	"camí de ses Rotes"							"way"	"  51553630"		"{'highway': 'track', 'name': 'camí de ses Rotes'}"
"camí de So na Rossa"	"camí de So na Rossa"							"way"	" 741885723"		"{'highway': 'unclassified', 'name': 'camí de So na Rossa', 'surface': 'asphalt'}"
"Camí de Son Boi"	"Camí de Son Boi"							"way"	"  84442445"		"{'highway': 'unclassified', 'name': 'Camí de Son Boi'}"
"camí de Son Campaner"	"camí de Son Campaner"							"way"	" 230248675"		"{'highway': 'track', 'name': 'camí de Son Campaner'}"
"camí de Son Canyís"	"camí de Son Canyís"							"way"	"  44641507"		"{'highway': 'unclassified', 'name': 'camí de Son Canyís', 'source': 'survey'}"
"camí de Son Creixell"	"camí de Son Creixell"							"way"	"  44641506"		"{'highway': 'unclassified', 'name': 'camí de Son Creixell', 'source': 'survey'}"
"camí de Son Fransoi"	"camí de Son Fransoi"							"way"	" 292764089"		"{'highway': 'track', 'name': 'camí de Son Fransoi', 'tracktype': 'grade1'}"
"camí de Son Fred"	"camí de Son Fred"							"way"	"  83523896"		"{'highway': 'track', 'name': 'camí de Son Fred'}"
"camí de Son Fred"	"camí de Son Fred"							"way"	"  83523893"		"{'highway': 'unclassified', 'name': 'camí de Son Fred'}"
"camí de Son Ganyada"	"camí de Son Ganyada"							"way"	" 480673543"		"{'highway': 'track', 'name': 'camí de Son Ganyada'}"
"camí de Son Gat"	"camí de Son Gat"							"way"	" 473058432"		"{'highway': 'track', 'name': 'camí de Son Gat'}"
"camí de Son Guillemet"	"camí de Son Guillemet"							"way"	" 457030814"		"{'highway': 'track', 'name': 'camí de Son Guillemet'}"
"camí de Son Llucià"	"camí de Son Llucià"							"way"	" 186923837"		"{'highway': 'unclassified', 'name': 'camí de Son Llucià', 'source': 'Bing WMS'}"
"camí de Son Lluny"	"camí de Son Lluny"							"way"	"  32146101"		"{'highway': 'unclassified', 'name': 'camí de Son Lluny'}"
"camí de Son Matet"	"camí de Son Matet"							"way"	"  84442496"		"{'highway': 'unclassified', 'name': 'camí de Son Matet', 'source': 'survey'}"
"camí de Son Mut"	"camí de Son Mut"							"way"	"  25317083"		"{'highway': 'unclassified', 'name': 'camí de Son Mut', 'surface': 'asphalt'}"
"camí de Son Palou vell"	"camí de Son Palou vell"							"way"	" 860681233"		"{'highway': 'track', 'name': 'camí de Son Palou vell'}"
"camí de Son Roig"	"camí de Son Roig"							"way"	"  25652417"		"{'bicycle': 'designated', 'highway': 'unclassified', 'name': 'camí de Son Roig', 'surface': 'asphalt'}"
"camí de Son Tomasset"	"camí de Son Tomasset"							"way"	"  32144283"		"{'highway': 'unclassified', 'name': 'camí de Son Tomasset'}"
"camí de Son Verd"	"camí de Son Verd"							"way"	"  83523910"		"{'highway': 'unclassified', 'name': 'camí de Son Verd'}"
"camí de Son Xotano"	"camí de Son Xotano"							"way"	" 860681237"		"{'highway': 'track', 'name': 'camí de Son Xotano'}"
"Camí de Son Xotano"	"Camí de Son Xotano"							"way"	" 910500276"		"{'highway': 'track', 'name': 'Camí de Son Xotano'}"
"Camí de Son Xotano"	"Camí de Son Xotano"							"way"	" 910500273"		"{'highway': 'track', 'name': 'Camí de Son Xotano'}"
"camí del Pou Major"	"camí del Pou Major"							"way"	"  32784107"		"{'highway': 'unclassified', 'name': 'camí del Pou Major', 'surface': 'asphalt'}"
"camí dels Horts"	"camí dels Horts"							"way"	" 679229721"		"{'bridge': 'yes', 'highway': 'unclassified', 'layer': '1', 'name': 'camí dels Horts'}"
"Camí dels Horts"	"Camí dels Horts"							"way"	" 679229720"		"{'highway': 'unclassified', 'name': 'Camí dels Horts'}"
"Camí dels Inferns"	"Camí dels Inferns"							"way"	"  84442509"		"{'highway': 'track', 'name': 'Camí dels Inferns', 'source': 'survey', 'surface': 'dirt'}"
"Camí dels Rubiols"	"Camí dels Rubiols"							"way"	"  85159159"		"{'bicycle': 'yes', 'foot': 'yes', 'highway': 'track', 'horse': 'yes', 'motor_vehicle': 'yes', 'name': 'Camí dels Rubiols', 'surface': 'unpaved'}"
"camí des Camp de sa Cova"	"camí des Camp de sa Cova"							"way"	"  84442516"		"{'highway': 'track', 'name': 'camí des Camp de sa Cova', 'source': 'survey'}"
"Camí des Campàs"	"Camí des Campàs"							"way"	"  32134967"		"{'highway': 'unclassified', 'name': 'Camí des Campàs'}"
"camí des Pou d'en Brivó"	"camí des Pou d'en Brivó"							"way"	"  83523913"		"{'highway': 'unclassified', 'name': \"camí des Pou d'en Brivó\"}"
"camí des Puputs"	"camí des Puputs"							"way"	"  32606657"		"{'highway': 'track', 'name': 'camí des Puputs'}"
"Camí des Terrer Blanc"	"Camí des Terrer Blanc"							"way"	"  50293644"		"{'cycleway:both': 'no', 'highway': 'unclassified', 'lane_markings': 'no', 'name': 'Camí des Terrer Blanc', 'surface': 'asphalt'}"
"Camí des Terrer Blanc"	"Camí des Terrer Blanc"							"way"	" 741886404"		"{'bridge': 'yes', 'cycleway:both': 'no', 'highway': 'unclassified', 'lane_markings': 'no', 'layer': '1', 'name': 'Camí des Terrer Blanc', 'surface': 'asphalt'}"
"Camí des Terrer Blanc"	"Camí des Terrer Blanc"							"way"	" 741886405"		"{'highway': 'unclassified', 'name': 'Camí des Terrer Blanc'}"
"camí des Velar"	"camí des Velar"							"way"	"  32607117"		"{'created_by': 'JOSM', 'highway': 'unclassified', 'name': 'camí des Velar'}"
"camí Dret"	"camí Dret"							"way"	"  32607326"		"{'highway': 'unclassified', 'name': 'camí Dret'}"
"Camí Dret / Camí des Pujolí"	"Camí Dret / Camí des Pujolí"							"way"	"  32607433"		"{'highway': 'track', 'name': 'Camí Dret / Camí des Pujolí', 'smoothness': 'bad', 'surface': 'gravel', 'tracktype': 'grade2'}"
"camí vell d'Inca"	"camí vell d'Inca"	"camí de Son Roig"	"camí de Son Roig"					"way"	"  81943162"		"{'alt_name': 'camí de Son Roig', 'highway': 'unclassified', 'name': \"camí vell d'Inca\", 'surface': 'asphalt'}"
"Camí vell de Costitx"	"Camí vell de Costitx"							"way"	"  32144281"		"{'highway': 'track', 'name': 'Camí vell de Costitx'}"
"Camí vell de Costitx"	"Camí vell de Costitx"							"way"	"  25317085"		"{'highway': 'track', 'name': 'Camí vell de Costitx', 'surface': 'gravel', 'tracktype': 'grade3'}"
"camí vell de Jornets"	"camí vell de Jornets"							"way"	" 532198940"		"{'highway': 'track', 'name': 'camí vell de Jornets'}"
"camí vell de Jornets"	"camí vell de Jornets"							"way"	" 219245137"		"{'highway': 'track', 'name': 'camí vell de Jornets'}"
"camí vell de Muro"	"camí vell de Muro"							"way"	"  47841928"		"{'bicycle': 'designated', 'class:bicycle:roadcycling': '1', 'highway': 'unclassified', 'maxspeed': '40', 'name': 'camí vell de Muro', 'surface': 'asphalt'}"
"camí vell de Muro"	"camí vell de Muro"							"way"	" 186923833"		"{'bicycle': 'designated', 'class:bicycle:roadcycling': '1', 'highway': 'unclassified', 'name': 'camí vell de Muro', 'surface': 'asphalt'}"
"camí vell de Muro"	"camí vell de Muro"							"way"	" 186923832"		"{'bicycle': 'designated', 'bridge': 'yes', 'class:bicycle:roadcycling': '1', 'highway': 'unclassified', 'layer': '1', 'name': 'camí vell de Muro', 'surface': 'asphalt'}"
"camí vell de Muro"	"camí vell de Muro"							"way"	" 472877259"		"{'bicycle': 'designated', 'class:bicycle:roadcycling': '1', 'highway': 'unclassified', 'lane_markings': 'no', 'name': 'camí vell de Muro', 'surface': 'asphalt'}"
"camí vell de Sencelles a Llubí"	"camí vell de Sencelles a Llubí"							"way"	"  60357054"		"{'highway': 'track', 'name': 'camí vell de Sencelles a Llubí', 'source': 'ideib WMS layer'}"
"carrer Antoni J. Llabrés Mudoy"	"carrer Antoni J. Llabrés Mudoy"							"way"	"  83628844"		"{'highway': 'residential', 'name': 'carrer Antoni J. Llabrés Mudoy', 'oneway': 'yes'}"
"carrer Antoni J. Llabrés Mudoy"	"carrer Antoni J. Llabrés Mudoy"							"way"	"  32134968"		"{'highway': 'residential', 'name': 'carrer Antoni J. Llabrés Mudoy'}"
"carrer d'Antoni Maura"	"carrer d'Antoni Maura"							"way"	"  23842474"		"{'highway': 'tertiary', 'name': \"carrer d'Antoni Maura\", 'oneway': 'yes', 'ref': 'Ma-3120', 'surface': 'asphalt'}"
"carrer d'en Fiol"	"carrer d'en Fiol"							"way"	"  25146913"		"{'highway': 'tertiary', 'name': \"carrer d'en Fiol\", 'ref': 'Ma-3221'}"
"carrer de l'Església"	"carrer de l'Església"							"way"	"  83628839"		"{'highway': 'residential', 'name': \"carrer de l'Església\", 'surface': 'asphalt'}"
"Carrer de l'Esperança"	"Carrer de l'Esperança"							"way"	"  44640925"		"{'highway': 'residential', 'name': \"Carrer de l'Esperança\"}"
"carrer de l'Estrella"	"carrer de l'Estrella"							"way"	"  50293641"		"{'highway': 'residential', 'name': \"carrer de l'Estrella\", 'surface': 'asphalt'}"
"Carrer de la Caritat"	"Carrer de la Caritat"							"way"	"  44640930"		"{'highway': 'residential', 'name': 'Carrer de la Caritat'}"
"carrer de la Constitució"	"carrer de la Constitució"							"way"	"  23842487"		"{'highway': 'residential', 'name': 'carrer de la Constitució', 'oneway': 'yes'}"
"carrer de la Glòria"	"carrer de la Glòria"							"way"	"  51906920"		"{'highway': 'residential', 'lit': 'yes', 'name': 'carrer de la Glòria', 'sidewalk': 'none', 'surface': 'asphalt'}"
"carrer de la Pau"	"carrer de la Pau"							"way"	"  51906921"		"{'highway': 'residential', 'lit': 'yes', 'name': 'carrer de la Pau', 'surface': 'asphalt'}"
"Carrer de la Pau"	"Carrer de la Pau"							"way"	"  44640932"		"{'highway': 'residential', 'name': 'Carrer de la Pau'}"
"Carrer de Ruberts"	"Carrer de Ruberts"							"way"	" 146727290"		"{'highway': 'residential', 'name': 'Carrer de Ruberts', 'source:name': 'cadastre'}"
"Carrer de Ruberts"	"Carrer de Ruberts"							"way"	"  28054333"		"{'highway': 'residential', 'name': 'Carrer de Ruberts', 'source:name': 'cadastre'}"
"Carrer de Ruberts"	"Carrer de Ruberts"							"way"	" 146727287"		"{'highway': 'residential', 'name': 'Carrer de Ruberts', 'source:name': 'cadastre', 'surface': 'asphalt'}"
"carrer de sa Quintana"	"carrer de sa Quintana"							"way"	" 231922449"		"{'highway': 'residential', 'name': 'carrer de sa Quintana', 'surface': 'asphalt'}"
"carrer de Sant Isidre"	"carrer de Sant Isidre"							"way"	"  72665778"		"{'highway': 'residential', 'name': 'carrer de Sant Isidre', 'source': 'ideib.cat'}"
"carrer de Sant Joan"	"carrer de Sant Joan"							"way"	"  50293637"		"{'highway': 'residential', 'name': 'carrer de Sant Joan'}"
"carrer de Sant Llorenç"	"carrer de Sant Llorenç"							"way"	"  51906922"		"{'highway': 'residential', 'name': 'carrer de Sant Llorenç', 'surface': 'asphalt'}"
"Carrer de Son Arrom"	"Carrer de Son Arrom"							"way"	" 909569103"		"{'highway': 'residential', 'name': 'Carrer de Son Arrom'}"
"carrer de Son Pelea"	"carrer de Son Pelea"							"way"	"  83628860"		"{'highway': 'residential', 'name': 'carrer de Son Pelea'}"
"carrer de Sor Francinaina Cirer"	"carrer de Sor Francinaina Cirer"							"way"	"  23842473"		"{'highway': 'tertiary', 'maxspeed': '30', 'name': 'carrer de Sor Francinaina Cirer', 'oneway': 'yes', 'ref': 'Ma-3120'}"
"carrer del Molí"	"carrer del Molí"							"way"	"  51906919"		"{'highway': 'residential', 'lit': 'yes', 'name': 'carrer del Molí', 'sidewalk': 'left', 'surface': 'asphalt'}"
"carrer del Papa"	"carrer del Papa"							"way"	"  32134966"		"{'highway': 'residential', 'name': 'carrer del Papa'}"
"Carrer del Rector Molinas"	"Carrer del Rector Molinas"							"way"	"  32134969"		"{'highway': 'residential', 'name': 'Carrer del Rector Molinas', 'surface': 'asphalt'}"
"carrer del Rosari"	"carrer del Rosari"							"way"	"  84442523"		"{'highway': 'residential', 'name': 'carrer del Rosari', 'oneway': 'yes'}"
"carrer dels Bons Aires"	"carrer dels Bons Aires"							"way"	"  84442476"		"{'highway': 'residential', 'name': 'carrer dels Bons Aires', 'surface': 'asphalt'}"
"carrer dels Bons Aires"	"carrer dels Bons Aires"							"way"	"  25077745"		"{'highway': 'residential', 'name': 'carrer dels Bons Aires', 'oneway': 'yes', 'surface': 'asphalt'}"
"carrer dels Donants de Sang"	"carrer dels Donants de Sang"							"way"	"  25317079"		"{'highway': 'residential', 'name': 'carrer dels Donants de Sang', 'oneway': 'yes'}"
"carrer des Capità"	"carrer des Capità"							"way"	" 909569102"		"{'highway': 'residential', 'name': 'carrer des Capità'}"
"Carrer des Gall"	"Carrer des Gall"							"way"	" 120078784"		"{'highway': 'residential', 'name': 'Carrer des Gall', 'oneway': 'yes'}"
"Carrer des Gall"	"Carrer des Gall"							"way"	"  44640923"		"{'highway': 'residential', 'name': 'Carrer des Gall', 'oneway': 'yes'}"
"Carrer des General"	"Carrer des General"							"way"	"  44640935"		"{'highway': 'residential', 'name': 'Carrer des General'}"
"carrer des Jardins"	"carrer des Jardins"							"way"	"  84442462"		"{'highway': 'residential', 'name': 'carrer des Jardins', 'oneway': 'yes'}"
"carrer des Molins"	"carrer des Molins"							"way"	"  55263413"		"{'highway': 'residential', 'name': 'carrer des Molins'}"
"Carrer des Pou"	"Carrer des Pou"							"way"	"  50293643"		"{'cycleway:both': 'no', 'highway': 'tertiary', 'lanes': '2', 'maxweight': '26 t', 'name': 'Carrer des Pou', 'ref': 'Ma-3021', 'surface': 'asphalt'}"
"Carrer des Pou"	"Carrer des Pou"							"way"	"1051003983"		"{'cycleway:both': 'no', 'destination': 'Carrer des Pou', 'destination:ref': 'Ma-3021', 'highway': 'primary_link', 'lanes': '2', 'maxweight': '26 t', 'name': 'Carrer des Pou', 'oneway': 'yes', 'ref': 'Ma-3020', 'surface': 'asphalt'}"
"carrer des Rafal"	"carrer des Rafal"							"way"	"  44641505"		"{'highway': 'residential', 'name': 'carrer des Rafal', 'oneway': 'yes', 'ref': 'Ma-3140', 'surface': 'asphalt'}"
"carrer des Rafal"	"carrer des Rafal"							"way"	" 365105432"		"{'highway': 'residential', 'name': 'carrer des Rafal', 'oneway': 'yes', 'ref': 'Ma-3140', 'surface': 'asphalt'}"
"Carrer des Retiro"	"Carrer des Retiro"							"way"	"  44640926"		"{'highway': 'residential', 'name': 'Carrer des Retiro', 'oneway': 'yes'}"
"Carrer des ses Escoles"	"Carrer des ses Escoles"							"way"	"  44640929"		"{'highway': 'residential', 'name': 'Carrer des ses Escoles', 'oneway': 'yes'}"
"Carrer des ses Escoles"	"Carrer des ses Escoles"							"way"	"  44640927"		"{'highway': 'residential', 'name': 'Carrer des ses Escoles', 'oneway': 'yes'}"
"carrer des Torrent"	"carrer des Torrent"							"way"	"  50293639"		"{'highway': 'residential', 'name': 'carrer des Torrent'}"
"carrer Jaume Sard"	"carrer Jaume Sard"							"way"	"  81943139"		"{'highway': 'residential', 'name': 'carrer Jaume Sard', 'oneway': 'yes'}"
"Carrer Llorenç Cartutxo"	"Carrer Llorenç Cartutxo"							"way"	"  32689321"		"{'highway': 'residential', 'name': 'Carrer Llorenç Cartutxo', 'oneway': 'yes'}"
"carrer Major"	"carrer Major"							"way"	"  72665776"		"{'cycleway:both': 'no', 'highway': 'tertiary', 'lane_markings': 'no', 'name': 'carrer Major', 'ref': 'Ma-3221', 'surface': 'asphalt'}"
"carrer Major"	"carrer Major"							"way"	" 233133237"		"{'highway': 'unclassified', 'name': 'carrer Major', 'surface': 'asphalt'}"
"Carrer Nou"	"Carrer Nou"							"way"	"  85159161"		"{'highway': 'residential', 'name': 'Carrer Nou', 'oneway': 'yes'}"
"Carrer Nou"	"Carrer Nou"							"way"	" 909569101"		"{'highway': 'residential', 'name': 'Carrer Nou'}"
"Carrer Nou"	"Carrer Nou"							"way"	"  44640933"		"{'highway': 'residential', 'name': 'Carrer Nou'}"
"carrer Ramon Llull"	"carrer Ramon Llull"							"way"	"  85159167"		"{'highway': 'residential', 'maxspeed': '30', 'name': 'carrer Ramon Llull', 'oneway': 'yes'}"
"Carrer Son Verd"	"Carrer Son Verd"							"way"	"  44640936"		"{'highway': 'residential', 'name': 'Carrer Son Verd'}"
"Plaça d'Espanya"	"Plaça d'Espanya"							"way"	" 334604583"		"{'highway': 'residential', 'name': \"Plaça d'Espanya\"}"
"Plaça d'Espanya"	"Plaça d'Espanya"							"way"	"  85159163"		"{'access': 'yes', 'amenity': 'parking', 'name': \"Plaça d'Espanya\", 'parking': 'lane', 'surface': 'asphalt'}"
"plaça de Jornets"	"plaça de Jornets"							"way"	" 233133235"		"{'highway': 'unclassified', 'name': 'plaça de Jornets', 'surface': 'asphalt'}"
"plaça de l'Obra"	"plaça de l'Obra"							"way"	"  85159166"		"{'area': 'yes', 'highway': 'pedestrian', 'name': \"plaça de l'Obra\"}"
"plaça de la Concepció"	"plaça de la Concepció"							"way"	"  50293638"		"{'cycleway:both': 'no', 'highway': 'tertiary', 'name': 'plaça de la Concepció', 'ref': 'Ma-3021'}"
