"# EDITED with R"	""	""	""	""	""	""	""	""	""	""	""
"name"	"name:ca"	"alt_name"	"alt_name:ca"	"translations"	"ca.wikipedia_page"	"wikidata_type"	"wikidata_id"	"typeOSM"	"idOSM"	"multilang_names"	"all_tags"
"Camí de Can Batlle"	"Camí de Can Batlle"							"way"	" 469530533"		"{'bridge': 'yes', 'ford': 'yes', 'highway': 'unclassified', 'maxspeed': '20', 'name': 'Camí de Can Batlle'}"
"Camí de Can Batlle"	"Camí de Can Batlle"							"way"	" 469530534"		"{'highway': 'unclassified', 'maxspeed': '20', 'name': 'Camí de Can Batlle'}"
"Camí de Can Batlle"	"Camí de Can Batlle"							"way"	" 286430933"		"{'highway': 'unclassified', 'maxspeed': '20', 'name': 'Camí de Can Batlle'}"
"Camí de la Miana al Pujolet"	"Camí de la Miana al Pujolet"							"way"	" 420571988"		"{'highway': 'track', 'name': 'Camí de la Miana al Pujolet', 'source': 'PNOA', 'tracktype': 'grade2'}"
"Camí de Sant Ferriol"	"Camí de Sant Ferriol"							"node"	"1297840421"		"{'information': 'guidepost', 'name': 'Camí de Sant Ferriol', 'network:type': 'node_network', 'operator': 'Itinerànnia', 'rwn_ref': 'G136', 'tourism': 'information'}"
"Carrer de l'Església"	"Carrer de l'Església"							"way"	" 339329528"		"{'highway': 'unclassified', 'maxspeed': '30', 'name': \"Carrer de l'Església\", 'tracktype': 'grade2'}"
"Carrer del Mig"	"Carrer del Mig"							"way"	" 286430931"		"{'highway': 'unclassified', 'maxspeed': '20', 'name': 'Carrer del Mig', 'tracktype': 'grade2'}"
