"# EDITED with R"	""	""	""	""	""	""	""	""	""	""	""
"plaça de la Concepció"	"plaça de la Concepció"							"way"	"  50293640"		"{'area': 'yes', 'highway': 'pedestrian', 'name': 'plaça de la Concepció'}"
"Plaça de Sant Cristòfol"	"Plaça de Sant Cristòfol"							"way"	"  25146914"		"{'cycleway:both': 'no', 'highway': 'tertiary', 'lane_markings': 'no', 'name': 'Plaça de Sant Cristòfol', 'ref': 'Ma-3221', 'surface': 'paving_stones'}"
"plaça de Sant Ferran"	"plaça de Sant Ferran"							"way"	"  51906918"		"{'area': 'yes', 'highway': 'pedestrian', 'lit': 'yes', 'name': 'plaça de Sant Ferran', 'surface': 'paving_stones'}"
"plaça de Son Morei"	"plaça de Son Morei"							"way"	"  44640937"		"{'highway': 'residential', 'name': 'plaça de Son Morei'}"
"plaça de Son Morei"	"plaça de Son Morei"							"way"	" 884145248"		"{'amenity': 'parking', 'name': 'plaça de Son Morei'}"
"Plaça Espanya (Sencelles)"	"Plaça Espanya (Sencelles)"							"node"	"5734444190"		"{'bench': 'no', 'bus': 'yes', 'highway': 'bus_stop', 'name': 'Plaça Espanya (Sencelles)', 'network': 'Transports públics de Mallorca', 'operator': 'Consorci de Transports de Mallorca', 'passenger_information_display': 'no', 'public_transport': 'platform', 'ref': '47015', 'route_ref': '310', 'shelter': 'no'}"
"plaça Nova"	"plaça Nova"							"way"	" 390962251"		"{'amenity': 'parking', 'name': 'plaça Nova'}"
