"# EDITED with R"	""	""	""	""	""	""	""	""	""	""	""
"name"	"name:ca"	"alt_name"	"alt_name:ca"	"translations"	"ca.wikipedia_page"	"wikidata_type"	"wikidata_id"	"typeOSM"	"idOSM"	"multilang_names"	"all_tags"
"Pla de Can Colomer"	"Pla de Can Colomer"							"node"	"1241567111"		"{'name': 'Pla de Can Colomer', 'place': 'locality'}"
"Pla de Can Ferrer"	"Pla de Can Ferrer"							"node"	"5591071595"		"{'name': 'Pla de Can Ferrer'}"
"Pla de Can Tàpies"	"Pla de Can Tàpies"							"node"	"5591071575"		"{'name': 'Pla de Can Tàpies'}"
"Pla de la Bassa del Llop"	"Pla de la Bassa del Llop"							"node"	"1241560703"		"{'name': 'Pla de la Bassa del Llop', 'place': 'locality'}"
"Pla de la Majordona"	"Pla de la Majordona"							"node"	"1241553878"		"{'name': 'Pla de la Majordona', 'place': 'locality'}"
"Pla Marcell"	"Pla Marcell"							"node"	"1241554928"		"{'name': 'Pla Marcell', 'place': 'locality'}"
