"# EDITED with R"	""	""	""	""	""	""	""	""	""	""	""
"name"	"name:ca"	"alt_name"	"alt_name:ca"	"translations"	"ca.wikipedia_page"	"wikidata_type"	"wikidata_id"	"typeOSM"	"idOSM"	"multilang_names"	"all_tags"
"Còrrec de la Font freda"	"Còrrec de la Font freda"							"way"	"837105609"		"{'name': 'Còrrec de la Font freda', 'source': 'BDOrtho IGN;BD Carthage', 'waterway': 'stream'}"
"Còrrec de la Font freda"	"Còrrec de la Font freda"							"way"	"837105610"		"{'name': 'Còrrec de la Font freda', 'source': 'BDOrtho IGN;BD Carthage', 'waterway': 'stream'}"
"Còrrec de la Font negra"	"Còrrec de la Font negra"							"way"	"837105611"		"{'name': 'Còrrec de la Font negra', 'source': 'BDOrtho IGN;BD Carthage', 'waterway': 'stream'}"
"Còrrec del Roc dels Pasquers"	"Còrrec del Roc dels Pasquers"							"way"	"866600213"		"{'intermittent': 'yes', 'name': 'Còrrec del Roc dels Pasquers', 'waterway': 'stream'}"
