"# EDITED with R"	""	""	""	""	""	""	""	""	""	""	""
"name"	"name:ca"	"alt_name"	"alt_name:ca"	"translations"	"ca.wikipedia_page"	"wikidata_type"	"wikidata_id"	"typeOSM"	"idOSM"	"multilang_names"	"all_tags"
"Barranc de Damunt la Vila"	"Barranc de Damunt la Vila"							"way"	"875797273"		"{'name': 'Barranc de Damunt la Vila', 'waterway': 'river'}"
"Barranc de Damunt Vila"	"Barranc de Damunt Vila"							"way"	"644307198"		"{'intermittent': 'yes', 'name': 'Barranc de Damunt Vila', 'waterway': 'stream'}"
"Barranc de la Pixera"	"Barranc de la Pixera"							"way"	"415222313"		"{'intermittent': 'yes', 'name': 'Barranc de la Pixera', 'waterway': 'stream'}"
"Tossal del Tomàs"	"Tossal del Tomàs"							"node"	"5110841831"		"{'ele': '1012.1', 'name': 'Tossal del Tomàs', 'natural': 'peak', 'source': 'Institut Cartogràfic i Geològic de Catalunya'}"
