"# EDITED with R"	""	""	""	""	""	""	""	""	""	""	""
"name"	"name:ca"	"alt_name"	"alt_name:ca"	"translations"	"ca.wikipedia_page"	"wikidata_type"	"wikidata_id"	"typeOSM"	"idOSM"	"multilang_names"	"all_tags"
"Còrrec de Caraig"	"Còrrec de Caraig"	"Còrrec de la Selva"	"Còrrec de la Selva"					"relation"	"11493737"		"{'alt_name': 'Còrrec de la Selva', 'name': 'Còrrec de Caraig', 'ref:sandre': 'Y0310520', 'type': 'waterway', 'waterway': 'stream'}"
"Còrrec de la Coma Mora"	"Còrrec de la Coma Mora"							"way"	"836196743"		"{'intermittent': 'yes', 'name': 'Còrrec de la Coma Mora', 'source': 'BDOrtho IGN;BD Carthage', 'waterway': 'stream'}"
"Còrrec de la Gotina"	"Còrrec de la Gotina"							"way"	"836196757"		"{'intermittent': 'yes', 'name': 'Còrrec de la Gotina', 'source': 'BDOrtho IGN;BD Carthage', 'waterway': 'stream'}"
"Còrrec de la Plantada"	"Còrrec de la Plantada"							"way"	"760016451"		"{'intermittent': 'yes', 'name': 'Còrrec de la Plantada', 'source': 'BD Topo Hydrographie 2017', 'waterway': 'ditch'}"
"Còrrec de la Selva"	"Còrrec de la Selva"							"way"	"836196777"		"{'intermittent': 'yes', 'name': 'Còrrec de la Selva', 'source': 'BDOrtho IGN;BD Carthage', 'waterway': 'stream'}"
"Còrrec del Mal d'en Delom"	"Còrrec del Mal d'en Delom"							"way"	"836196786"		"{'intermittent': 'yes', 'name': \"Còrrec del Mal d'en Delom\", 'source': 'BDOrtho IGN;BD Carthage', 'waterway': 'stream'}"
"Còrrec del Torrer Blanc"	"Còrrec del Torrer Blanc"							"way"	"836196739"		"{'intermittent': 'yes', 'name': 'Còrrec del Torrer Blanc', 'source': 'BDOrtho IGN;BD Carthage', 'waterway': 'stream'}"
