"# EDITED with R"	""	""	""	""	""	""	""	""	""	""	""
"name"	"name:ca"	"alt_name"	"alt_name:ca"	"translations"	"ca.wikipedia_page"	"wikidata_type"	"wikidata_id"	"typeOSM"	"idOSM"	"multilang_names"	"all_tags"
"Camí d'Alfara de Carles al Toscar"	"Camí d'Alfara de Carles al Toscar"							"way"	"140923391"		"{'highway': 'track', 'name': \"Camí d'Alfara de Carles al Toscar\", 'surface': 'concrete', 'tracktype': 'grade1'}"
"Camí d'Alfara de Carles al Toscar"	"Camí d'Alfara de Carles al Toscar"							"way"	"140923336"		"{'highway': 'track', 'name': \"Camí d'Alfara de Carles al Toscar\", 'surface': 'asphalt', 'tracktype': 'grade1'}"
"Camí d'Alfara de Carles al Toscar"	"Camí d'Alfara de Carles al Toscar"							"way"	"182395594"		"{'highway': 'track', 'name': \"Camí d'Alfara de Carles al Toscar\", 'surface': 'concrete', 'tracktype': 'grade1'}"
"Camí d'Alfara de Carles al Toscar"	"Camí d'Alfara de Carles al Toscar"							"way"	"509696272"		"{'highway': 'path', 'name': \"Camí d'Alfara de Carles al Toscar\"}"
"Camí de l'Enclusa"	"Camí de l'Enclusa"							"way"	"238788699"		"{'highway': 'track', 'name': \"Camí de l'Enclusa\", 'tracktype': 'grade3'}"
"Camí de la Cova Pintada"	"Camí de la Cova Pintada"							"way"	"635425433"		"{'highway': 'path', 'name': 'Camí de la Cova Pintada', 'sac_scale': 'mountain_hiking', 'trail_visibility': 'good'}"
"Camí de la Cova Pintada"	"Camí de la Cova Pintada"							"way"	"141051421"		"{'highway': 'path', 'name': 'Camí de la Cova Pintada', 'sac_scale': 'mountain_hiking', 'trail_visibility': 'good'}"
"Camí de la Font de Nadal"	"Camí de la Font de Nadal"							"way"	"168180970"		"{'highway': 'track', 'name': 'Camí de la Font de Nadal'}"
"Camí de la Font de Perera"	"Camí de la Font de Perera"							"way"	"944572150"		"{'highway': 'track', 'name': 'Camí de la Font de Perera'}"
"Camí de la Gavarda"	"Camí de la Gavarda"							"way"	"508029783"		"{'highway': 'track', 'name': 'Camí de la Gavarda', 'tracktype': 'grade2'}"
"Camí de la Gavarda"	"Camí de la Gavarda"							"way"	"166121544"		"{'highway': 'track', 'name': 'Camí de la Gavarda'}"
"Camí de la Mola de Catí"	"Camí de la Mola de Catí"							"way"	"166121545"		"{'highway': 'track', 'name': 'Camí de la Mola de Catí', 'tracktype': 'grade2'}"
"Camí de la Mola de Catí"	"Camí de la Mola de Catí"							"way"	"141060190"		"{'highway': 'track', 'name': 'Camí de la Mola de Catí', 'tracktype': 'grade1'}"
"Camí de la Mola de Catí"	"Camí de la Mola de Catí"							"way"	"140954192"		"{'highway': 'track', 'name': 'Camí de la Mola de Catí'}"
"Camí de les Canals"	"Camí de les Canals"							"way"	" 97213608"		"{'highway': 'path', 'mtb:scale': '4', 'name': 'Camí de les Canals', 'sac_scale': 'mountain_hiking'}"
"Camí de les Feixes"	"Camí de les Feixes"							"way"	"141051396"		"{'highway': 'path', 'name': 'Camí de les Feixes', 'sac_scale': 'mountain_hiking', 'trail_visibility': 'good'}"
"Camí de les Foies"	"Camí de les Foies"							"way"	"141051412"		"{'highway': 'path', 'name': 'Camí de les Foies', 'sac_scale': 'mountain_hiking', 'trail_visibility': 'good'}"
"Camí de Mas de n'Adell"	"Camí de Mas de n'Adell"							"way"	"667703400"		"{'highway': 'unclassified', 'name': \"Camí de Mas de n'Adell\", 'surface': 'asphalt'}"
"Camí de Paüls a Alfara de Carles"	"Camí de Paüls a Alfara de Carles"							"way"	"182400555"		"{'highway': 'path', 'name': 'Camí de Paüls a Alfara de Carles', 'sac_scale': 'hiking', 'surface': 'ground', 'trail_visibility': 'good'}"
"Camí de Xerta a Alfara de Carles"	"Camí de Xerta a Alfara de Carles"							"way"	"669392195"		"{'highway': 'track', 'name': 'Camí de Xerta a Alfara de Carles', 'tracktype': 'grade2'}"
"Camí del Bosc de l'Espina a Alfara de Carles"	"Camí del Bosc de l'Espina a Alfara de Carles"							"way"	"668977318"		"{'highway': 'path', 'name': \"Camí del Bosc de l'Espina a Alfara de Carles\", 'sac_scale': 'mountain_hiking'}"
"Camí del Mas de la Roca"	"Camí del Mas de la Roca"							"way"	"652336480"		"{'highway': 'track', 'name': 'Camí del Mas de la Roca'}"
"Camí dels Reguers a la Vall Cervera"	"Camí dels Reguers a la Vall Cervera"							"way"	"561569938"		"{'highway': 'track', 'name': 'Camí dels Reguers a la Vall Cervera', 'tracktype': 'grade1'}"
"Camí dels Reguers a la Vall Cervera"	"Camí dels Reguers a la Vall Cervera"							"way"	"292105360"		"{'highway': 'track', 'name': 'Camí dels Reguers a la Vall Cervera', 'tracktype': 'grade1'}"
"Camí Nou"	"Camí Nou"							"way"	"669768461"		"{'highway': 'track', 'name': 'Camí Nou', 'tracktype': 'grade4'}"
"Carrer Bonaire"	"Carrer Bonaire"							"way"	"382065519"		"{'highway': 'living_street', 'name': 'Carrer Bonaire'}"
"Carrer de Dalt"	"Carrer de Dalt"							"way"	"229357332"		"{'highway': 'living_street', 'name': 'Carrer de Dalt'}"
"Carrer de la Bassa"	"Carrer de la Bassa"							"way"	"382065508"		"{'highway': 'living_street', 'name': 'Carrer de la Bassa'}"
"Carrer de Paüls"	"Carrer de Paüls"							"way"	"229357319"		"{'highway': 'living_street', 'name': 'Carrer de Paüls'}"
"Carrer de Sant Agustí"	"Carrer de Sant Agustí"							"way"	"229357330"		"{'highway': 'residential', 'name': 'Carrer de Sant Agustí'}"
"Carrer de Sant Agustí"	"Carrer de Sant Agustí"							"way"	"634992976"		"{'highway': 'residential', 'name': 'Carrer de Sant Agustí'}"
"Carrer de Sant Julià"	"Carrer de Sant Julià"							"way"	"229357336"		"{'highway': 'residential', 'name': 'Carrer de Sant Julià'}"
"Carrer de Soler Morey"	"Carrer de Soler Morey"							"way"	"182400528"		"{'highway': 'tertiary', 'name': 'Carrer de Soler Morey', 'ref': 'TV-3422'}"
"Carrer de Trenquet"	"Carrer de Trenquet"							"way"	"229357326"		"{'highway': 'living_street', 'name': 'Carrer de Trenquet'}"
"Carrer de Trenquet"	"Carrer de Trenquet"							"way"	"229357337"		"{'highway': 'living_street', 'name': 'Carrer de Trenquet'}"
"Carrer de Trenquet"	"Carrer de Trenquet"							"way"	"382065506"		"{'highway': 'living_street', 'name': 'Carrer de Trenquet'}"
"Carrer de Xerta"	"Carrer de Xerta"							"way"	"229357322"		"{'highway': 'living_street', 'name': 'Carrer de Xerta'}"
"Carrer de Xerta"	"Carrer de Xerta"							"way"	"229357339"		"{'highway': 'living_street', 'name': 'Carrer de Xerta'}"
"Carrer de Xerta"	"Carrer de Xerta"							"way"	"382065507"		"{'highway': 'living_street', 'name': 'Carrer de Xerta'}"
"Carrer del Bonaire"	"Carrer del Bonaire"							"way"	"229357338"		"{'highway': 'living_street', 'name': 'Carrer del Bonaire'}"
"Carrer Major"	"Carrer Major"							"way"	"229357335"		"{'highway': 'living_street', 'name': 'Carrer Major'}"
"Carrer Nou"	"Carrer Nou"							"way"	"229357327"		"{'highway': 'living_street', 'name': 'Carrer Nou'}"
"Carrer Palmerar"	"Carrer Palmerar"							"way"	"229357323"		"{'highway': 'living_street', 'name': 'Carrer Palmerar'}"
"Carrer Palmerar"	"Carrer Palmerar"							"way"	"229357334"		"{'highway': 'living_street', 'name': 'Carrer Palmerar'}"
"Plaça Major"	"Plaça Major"							"way"	"382065510"		"{'highway': 'living_street', 'name': 'Plaça Major'}"
