"# EDITED with R"	""	""	""	""	""	""	""	""	""	""	""
"name"	"name:ca"	"alt_name"	"alt_name:ca"	"translations"	"ca.wikipedia_page"	"wikidata_type"	"wikidata_id"	"typeOSM"	"idOSM"	"multilang_names"	"all_tags"
"Còrrec de la Calcina"	"Còrrec de la Calcina"							"way"	"760016448"		"{'intermittent': 'yes', 'name': 'Còrrec de la Calcina', 'source': 'BD Topo Hydrographie 2017', 'waterway': 'ditch'}"
"Còrrec de la Calcina"	"Còrrec de la Calcina"							"way"	"538207565"		"{'intermittent': 'yes', 'name': 'Còrrec de la Calcina', 'waterway': 'ditch'}"
"Còrrec de la Dou"	"Còrrec de la Dou"							"way"	"760016444"		"{'intermittent': 'yes', 'name': 'Còrrec de la Dou', 'source': 'BD Topo Hydrographie 2017', 'waterway': 'ditch'}"
"Còrrec del Bosc Negre"	"Còrrec del Bosc Negre"							"way"	"760016449"		"{'intermittent': 'yes', 'name': 'Còrrec del Bosc Negre', 'source': 'BD Topo Hydrographie 2017', 'waterway': 'ditch'}"
"Còrrec del Romegós"	"Còrrec del Romegós"							"way"	"760016443"		"{'intermittent': 'yes', 'name': 'Còrrec del Romegós', 'source': 'BD Topo Hydrographie 2017', 'waterway': 'ditch'}"
