"# EDITED with R"	""	""	""	""	""	""	""	""	""	""	""
"name"	"name:ca"	"alt_name"	"alt_name:ca"	"translations"	"ca.wikipedia_page"	"wikidata_type"	"wikidata_id"	"typeOSM"	"idOSM"	"multilang_names"	"all_tags"
"Avinguda de la Font del Badia"	"Avinguda de la Font del Badia"							"way"	" 207905182"		"{'highway': 'residential', 'name': 'Avinguda de la Font del Badia'}"
"Camí d'Esteban"	"Camí d'Esteban"							"way"	" 246115131"		"{'highway': 'residential', 'name': \"Camí d'Esteban\"}"
"Camí de Bardines"	"Camí de Bardines"							"way"	" 228145883"		"{'highway': 'track', 'name': 'Camí de Bardines', 'surface': 'dust', 'tracktype': 'grade1'}"
"Camí de Bellprat a Almenara"	"Camí de Bellprat a Almenara"							"way"	" 417394191"		"{'highway': 'track', 'name': 'Camí de Bellprat a Almenara', 'tracktype': 'grade3'}"
"Camí de Bellprat a Almenara"	"Camí de Bellprat a Almenara"							"way"	" 417394204"		"{'highway': 'track', 'name': 'Camí de Bellprat a Almenara', 'tracktype': 'grade2'}"
"Camí de Cal Porta"	"Camí de Cal Porta"							"way"	" 490315057"		"{'highway': 'track', 'name': 'Camí de Cal Porta'}"
"Camí de Cal Xic"	"Camí de Cal Xic"							"way"	" 246115117"		"{'highway': 'unclassified', 'name': 'Camí de Cal Xic'}"
"Camí de Cal Xoques"	"Camí de Cal Xoques"							"way"	" 246115115"		"{'highway': 'unclassified', 'name': 'Camí de Cal Xoques'}"
"Camí de Conesa"	"Camí de Conesa"							"way"	" 299350748"		"{'highway': 'unclassified', 'name': 'Camí de Conesa'}"
"Camí de Conesa"	"Camí de Conesa"							"way"	" 228145199"		"{'highway': 'unclassified', 'name': 'Camí de Conesa'}"
"Camí de les Escombraries"	"Camí de les Escombraries"							"way"	" 207766360"		"{'highway': 'track', 'name': 'Camí de les Escombraries'}"
"Camí de Pontils"	"Camí de Pontils"							"way"	" 493905299"		"{'highway': 'residential', 'name': 'Camí de Pontils'}"
"Camí de Pontils"	"Camí de Pontils"							"way"	" 411100261"		"{'highway': 'residential', 'name': 'Camí de Pontils'}"
"Camí de Rauric a la Casa Blanca"	"Camí de Rauric a la Casa Blanca"							"way"	" 299350783"		"{'highway': 'track', 'name': 'Camí de Rauric a la Casa Blanca', 'tracktype': 'grade1'}"
"Camí de Santa Coloma de Querat a Savallà"	"Camí de Santa Coloma de Querat a Savallà"							"way"	" 479963899"		"{'highway': 'track', 'name': 'Camí de Santa Coloma de Querat a Savallà'}"
"Camí del Mercadell"	"Camí del Mercadell"							"way"	" 209133996"		"{'highway': 'track', 'name': 'Camí del Mercadell'}"
"Camí del Pou"	"Camí del Pou"							"way"	" 571407916"		"{'highway': 'unclassified', 'name': 'Camí del Pou'}"
"Camí fondo"	"Camí fondo"							"way"	" 474034752"		"{'highway': 'path', 'name': 'Camí fondo'}"
"Camí ral d'Igualada"	"Camí ral d'Igualada"							"way"	" 207077350"		"{'highway': 'track', 'name': \"Camí ral d'Igualada\", 'tracktype': 'grade1'}"
"Camí Ral d'Igualada"	"Camí Ral d'Igualada"							"way"	" 207766363"		"{'highway': 'track', 'name': \"Camí Ral d'Igualada\"}"
"Camí sense nom"	"Camí sense nom"							"way"	" 207898647"		"{'highway': 'residential', 'name': 'Camí sense nom'}"
"Camí vell d'Igualada"	"Camí vell d'Igualada"							"way"	" 207769291"		"{'highway': 'residential', 'name': \"Camí vell d'Igualada\"}"
"Camí vell de Calaf"	"Camí vell de Calaf"							"way"	"  50414559"		"{'access': 'yes', 'highway': 'unclassified', 'motorcar': 'yes', 'motorcycle': 'yes', 'name': 'Camí vell de Calaf', 'source': 'GPS Survey', 'surface': 'paved', 'tracktype': 'grade1'}"
"Camí vell de Savallà"	"Camí vell de Savallà"							"way"	" 477334550"		"{'bicycle': 'no', 'foot': 'yes', 'highway': 'residential', 'motor_vehicle': 'no', 'name': 'Camí vell de Savallà'}"
"Carrer d'Albió"	"Carrer d'Albió"							"way"	" 207905183"		"{'highway': 'residential', 'name': \"Carrer d'Albió\"}"
"Carrer d'Amselm Clavé"	"Carrer d'Amselm Clavé"							"way"	" 207898622"		"{'highway': 'residential', 'name': \"Carrer d'Amselm Clavé\"}"
"Carrer d'Àngel Guimerà"	"Carrer d'Àngel Guimerà"							"way"	" 207905184"	"name:etymology:wikidata=Q175485"	"{'highway': 'residential', 'name': \"Carrer d'Àngel Guimerà\", 'name:etymology:wikidata': 'Q175485'}"
"Carrer d'Hermenegild Carrera"	"Carrer d'Hermenegild Carrera"							"way"	" 207896932"		"{'highway': 'residential', 'name': \"Carrer d'Hermenegild Carrera\"}"
"Carrer de Bell-lloc"	"Carrer de Bell-lloc"							"way"	" 207760409"		"{'highway': 'residential', 'name': 'Carrer de Bell-lloc'}"
"Carrer de Francesc Macià"	"Carrer de Francesc Macià"							"way"	" 207762699"		"{'highway': 'residential', 'name': 'Carrer de Francesc Macià'}"
"Carrer de Francesc Macià"	"Carrer de Francesc Macià"							"way"	" 207762703"		"{'highway': 'residential', 'name': 'Carrer de Francesc Macià'}"
"Carrer de Francesc Moragas"	"Carrer de Francesc Moragas"							"way"	" 207764381"		"{'highway': 'residential', 'name': 'Carrer de Francesc Moragas', 'oneway': 'yes'}"
"Carrer de Francesc Moragas"	"Carrer de Francesc Moragas"							"way"	" 555836257"		"{'highway': 'residential', 'name': 'Carrer de Francesc Moragas', 'oneway': 'no'}"
"Carrer de Gubia"	"Carrer de Gubia"							"way"	"  38131682"		"{'highway': 'residential', 'name': 'Carrer de Gubia', 'oneway': 'yes', 'surface': 'paved'}"
"Carrer de Joan Miró"	"Carrer de Joan Miró"							"way"	" 207901728"		"{'highway': 'residential', 'name': 'Carrer de Joan Miró'}"
"Carrer de Josep Pla"	"Carrer de Josep Pla"							"way"	" 207901729"	"name:etymology:wikidata=Q740256"	"{'highway': 'residential', 'name': 'Carrer de Josep Pla', 'name:etymology:wikidata': 'Q740256'}"
"Carrer de l'Església"	"Carrer de l'Església"							"way"	" 224849060"		"{'highway': 'residential', 'name': \"Carrer de l'Església\"}"
"Carrer de l'Orfeó Català"	"Carrer de l'Orfeó Català"							"way"	" 207900990"		"{'highway': 'residential', 'name': \"Carrer de l'Orfeó Català\"}"
"Carrer de l'Orfeó Català"	"Carrer de l'Orfeó Català"							"way"	" 207901733"		"{'highway': 'residential', 'name': \"Carrer de l'Orfeó Català\"}"
"Carrer de la Carlania"	"Carrer de la Carlania"							"way"	" 207900991"		"{'highway': 'residential', 'name': 'Carrer de la Carlania'}"
"Carrer de la Cirera"	"Carrer de la Cirera"							"way"	" 207905188"		"{'highway': 'residential', 'name': 'Carrer de la Cirera'}"
"Carrer de la Costeta"	"Carrer de la Costeta"							"way"	" 224849059"		"{'highway': 'residential', 'name': 'Carrer de la Costeta'}"
"Carrer de la Font"	"Carrer de la Font"							"way"	" 207769284"		"{'highway': 'living_street', 'name': 'Carrer de la Font'}"
"Carrer de la Font"	"Carrer de la Font"							"way"	" 246115129"		"{'highway': 'residential', 'name': 'Carrer de la Font'}"
"Carrer de la Font de Canters"	"Carrer de la Font de Canters"							"way"	" 207760413"		"{'highway': 'residential', 'name': 'Carrer de la Font de Canters'}"
"Carrer de la Indústria"	"Carrer de la Indústria"							"way"	" 207760414"		"{'highway': 'residential', 'name': 'Carrer de la Indústria'}"
"Carrer de la Juventut Colomina"	"Carrer de la Juventut Colomina"							"way"	" 207762700"		"{'highway': 'residential', 'name': 'Carrer de la Juventut Colomina'}"
"Carrer de la Llibertat"	"Carrer de la Llibertat"							"way"	" 207898626"		"{'highway': 'residential', 'name': 'Carrer de la Llibertat'}"
"Carrer de la Marca"	"Carrer de la Marca"							"way"	" 207900992"		"{'highway': 'residential', 'name': 'Carrer de la Marca'}"
"Carrer de la Mare de Déu de Montserrat"	"Carrer de la Mare de Déu de Montserrat"							"way"	" 207760415"		"{'highway': 'residential', 'name': 'Carrer de la Mare de Déu de Montserrat'}"
"Carrer de la Pau"	"Carrer de la Pau"							"way"	" 207898627"		"{'highway': 'residential', 'name': 'Carrer de la Pau'}"
"Carrer de la Placeta"	"Carrer de la Placeta"							"way"	" 246115128"		"{'highway': 'residential', 'name': 'Carrer de la Placeta'}"
"Carrer de la Plana"	"Carrer de la Plana"							"way"	" 207894863"		"{'highway': 'residential', 'name': 'Carrer de la Plana', 'oneway': 'no', 'surface': 'paved'}"
"Carrer de la Ràpita"	"Carrer de la Ràpita"							"way"	" 207898629"		"{'highway': 'residential', 'name': 'Carrer de la Ràpita'}"
"Carrer de la Segarra"	"Carrer de la Segarra"							"way"	"  59432734"		"{'highway': 'residential', 'name': 'Carrer de la Segarra'}"
"Carrer de la Verge del Pilar"	"Carrer de la Verge del Pilar"							"way"	" 207760416"		"{'highway': 'residential', 'name': 'Carrer de la Verge del Pilar'}"
"Carrer de la Vinya del Castell"	"Carrer de la Vinya del Castell"							"way"	" 207905191"		"{'highway': 'residential', 'name': 'Carrer de la Vinya del Castell'}"
"Carrer de la Vinya del Senyor"	"Carrer de la Vinya del Senyor"							"way"	" 207905190"		"{'highway': 'residential', 'name': 'Carrer de la Vinya del Senyor'}"
"Carrer de les Carnisseries"	"Carrer de les Carnisseries"							"way"	" 207894820"		"{'highway': 'living_street', 'name': 'Carrer de les Carnisseries'}"
"Carrer de les Eres"	"Carrer de les Eres"							"way"	" 207900993"		"{'highway': 'residential', 'name': 'Carrer de les Eres'}"
"Carrer de les Flors"	"Carrer de les Flors"							"way"	" 207764385"		"{'highway': 'residential', 'name': 'Carrer de les Flors'}"
"Carrer de les Flors"	"Carrer de les Flors"							"way"	" 207764399"		"{'highway': 'unclassified', 'name': 'Carrer de les Flors'}"
"Carrer de les Flors"	"Carrer de les Flors"							"way"	"1013714725"		"{'highway': 'residential', 'name': 'Carrer de les Flors', 'priority': 'backward', 'traffic_calming': 'choker'}"
"Carrer de les Flors"	"Carrer de les Flors"							"way"	"1013714724"		"{'highway': 'residential', 'name': 'Carrer de les Flors'}"
"Carrer de les Quarteres"	"Carrer de les Quarteres"							"way"	" 207894821"		"{'highway': 'living_street', 'name': 'Carrer de les Quarteres'}"
"Carrer de les Quarteres"	"Carrer de les Quarteres"							"way"	" 207894860"		"{'highway': 'living_street', 'name': 'Carrer de les Quarteres', 'tunnel': 'yes'}"
"Carrer de les Quintanes"	"Carrer de les Quintanes"							"way"	" 571407917"		"{'highway': 'residential', 'name': 'Carrer de les Quintanes'}"
"Carrer de Llorac"	"Carrer de Llorac"							"way"	" 207905185"		"{'highway': 'residential', 'name': 'Carrer de Llorac'}"
"Carrer de Lluís Companys"	"Carrer de Lluís Companys"							"way"	" 207900987"		"{'highway': 'residential', 'name': 'Carrer de Lluís Companys'}"
"Carrer de Lluís Recasens"	"Carrer de Lluís Recasens"							"way"	" 207901730"		"{'highway': 'residential', 'name': 'Carrer de Lluís Recasens'}"
"Carrer de Lluís Recasens"	"Carrer de Lluís Recasens"							"way"	" 207901731"		"{'highway': 'residential', 'name': 'Carrer de Lluís Recasens'}"
"Carrer de Montpaó"	"Carrer de Montpaó"							"way"	" 207901736"		"{'highway': 'residential', 'name': 'Carrer de Montpaó'}"
"Carrer de Montpaó"	"Carrer de Montpaó"							"way"	" 207901732"		"{'highway': 'residential', 'name': 'Carrer de Montpaó'}"
"Carrer de Mossèn Jacint Verdaguer"	"Carrer de Mossèn Jacint Verdaguer"							"way"	" 207900988"	"name:etymology:wikidata=Q379290"	"{'highway': 'residential', 'name': 'Carrer de Mossèn Jacint Verdaguer', 'name:etymology:wikidata': 'Q379290'}"
"Carrer de Mossèn Joan Segura"	"Carrer de Mossèn Joan Segura"							"way"	" 839157138"		"{'cycleway:left': 'lane', 'cycleway:left:oneway': 'no', 'highway': 'residential', 'name': 'Carrer de Mossèn Joan Segura', 'surface': 'asphalt'}"
"Carrer de Mossèn Joan Segura"	"Carrer de Mossèn Joan Segura"							"way"	" 493905301"		"{'highway': 'residential', 'name': 'Carrer de Mossèn Joan Segura'}"
"Carrer de Mossèn Joan Segura"	"Carrer de Mossèn Joan Segura"							"way"	" 207760410"		"{'highway': 'residential', 'name': 'Carrer de Mossèn Joan Segura'}"
"Carrer de Mossèn Joan Segura"	"Carrer de Mossèn Joan Segura"							"way"	" 493905300"		"{'highway': 'residential', 'name': 'Carrer de Mossèn Joan Segura'}"
"Carrer de Nostra Senyora de la Mercè"	"Carrer de Nostra Senyora de la Mercè"							"way"	" 207760411"		"{'highway': 'residential', 'name': 'Carrer de Nostra Senyora de la Mercè'}"
"Carrer de Pau Casals"	"Carrer de Pau Casals"							"way"	" 207896937"	"name:etymology:wikidata=Q208537"	"{'highway': 'residential', 'name': 'Carrer de Pau Casals', 'name:etymology:wikidata': 'Q208537', 'oneway': 'yes'}"
"Carrer de Pau Casals"	"Carrer de Pau Casals"							"way"	" 207896933"	"name:etymology:wikidata=Q208537"	"{'highway': 'residential', 'name': 'Carrer de Pau Casals', 'name:etymology:wikidata': 'Q208537'}"
"Carrer de Pere II de Queralt"	"Carrer de Pere II de Queralt"							"way"	" 207898623"		"{'highway': 'residential', 'name': 'Carrer de Pere II de Queralt'}"
"Carrer de Rauric"	"Carrer de Rauric"							"way"	" 207901737"		"{'highway': 'residential', 'name': 'Carrer de Rauric'}"
"Carrer de Sant Jordi"	"Carrer de Sant Jordi"							"way"	" 207905186"		"{'highway': 'residential', 'name': 'Carrer de Sant Jordi'}"
"Carrer de Sant Josep"	"Carrer de Sant Josep"							"way"	" 207764383"		"{'highway': 'residential', 'name': 'Carrer de Sant Josep'}"
"Carrer de Sant Magí"	"Carrer de Sant Magí"							"way"	" 207760412"		"{'highway': 'residential', 'name': 'Carrer de Sant Magí'}"
"Carrer de Sant Vicenç"	"Carrer de Sant Vicenç"	"Carretera d'Igualada"	"Carretera d'Igualada"					"way"	" 200937055"		"{'alt_name': \"Carretera d'Igualada\", 'highway': 'tertiary', 'lanes': '2', 'maxspeed': '50', 'name': 'Carrer de Sant Vicenç', 'oneway': 'no', 'ref': 'C-241z'}"
"Carrer de Sant Vicenç"	"Carrer de Sant Vicenç"							"way"	" 561100348"		"{'highway': 'tertiary', 'name': 'Carrer de Sant Vicenç', 'oneway': 'yes'}"
"Carrer de Sant Vicenç"	"Carrer de Sant Vicenç"							"way"	" 561100352"		"{'highway': 'tertiary', 'name': 'Carrer de Sant Vicenç', 'oneway': 'yes'}"
"Carrer de Santa Caterina"	"Carrer de Santa Caterina"							"way"	" 207769283"		"{'highway': 'living_street', 'name': 'Carrer de Santa Caterina'}"
"Carrer de Santiago Rusinyol"	"Carrer de Santiago Rusinyol"							"way"	" 207905187"		"{'highway': 'residential', 'name': 'Carrer de Santiago Rusinyol'}"
"Carrer del Cadí"	"Carrer del Cadí"							"way"	" 207898631"		"{'highway': 'residential', 'name': 'Carrer del Cadí'}"
"Carrer del Call"	"Carrer del Call"							"way"	" 207894822"		"{'highway': 'living_street', 'name': 'Carrer del Call'}"
"Carrer del Canigó"	"Carrer del Canigó"							"way"	" 207898634"		"{'highway': 'residential', 'name': 'Carrer del Canigó'}"
"Carrer del Canigó"	"Carrer del Canigó"							"way"	" 207898640"		"{'highway': 'residential', 'name': 'Carrer del Canigó'}"
"Carrer del Castell"	"Carrer del Castell"							"way"	" 549229038"		"{'highway': 'unclassified', 'name': 'Carrer del Castell'}"
"Carrer del Castell"	"Carrer del Castell"							"way"	" 224849058"		"{'highway': 'residential', 'name': 'Carrer del Castell'}"
"Carrer del Castell"	"Carrer del Castell"							"way"	" 224849056"		"{'highway': 'residential', 'name': 'Carrer del Castell'}"
"Carrer del Forn"	"Carrer del Forn"							"way"	" 751139944"		"{'highway': 'residential', 'name': 'Carrer del Forn'}"
"Carrer del Forn de Baix"	"Carrer del Forn de Baix"							"way"	" 207894824"		"{'highway': 'living_street', 'name': 'Carrer del Forn de Baix'}"
"Carrer del Mig"	"Carrer del Mig"							"way"	" 207894826"		"{'highway': 'living_street', 'name': 'Carrer del Mig'}"
"Carrer del Molí de la Torre"	"Carrer del Molí de la Torre"							"way"	" 207760417"		"{'highway': 'residential', 'name': 'Carrer del Molí de la Torre'}"
"Carrer del Molí del Sol"	"Carrer del Molí del Sol"							"way"	" 207760418"		"{'highway': 'residential', 'name': 'Carrer del Molí del Sol'}"
"Carrer del Pare Palau i Quer"	"Carrer del Pare Palau i Quer"							"way"	" 207900994"		"{'highway': 'residential', 'name': 'Carrer del Pare Palau i Quer'}"
"Carrer del Pintor Nogués"	"Carrer del Pintor Nogués"							"way"	" 207764387"		"{'highway': 'residential', 'name': 'Carrer del Pintor Nogués'}"
"Carrer del Portal d'en Martí"	"Carrer del Portal d'en Martí"							"way"	" 207769286"		"{'highway': 'living_street', 'name': \"Carrer del Portal d'en Martí\"}"
"Carrer del Portal d'en Martí"	"Carrer del Portal d'en Martí"							"way"	" 207894828"		"{'highway': 'living_street', 'name': \"Carrer del Portal d'en Martí\"}"
"Carrer del Portal d'en Roca"	"Carrer del Portal d'en Roca"							"way"	" 207894830"		"{'highway': 'living_street', 'name': \"Carrer del Portal d'en Roca\"}"
"Carrer del Progrés"	"Carrer del Progrés"							"way"	" 207898636"		"{'highway': 'residential', 'name': 'Carrer del Progrés'}"
"Carrer del Serralet"	"Carrer del Serralet"							"way"	" 224849061"		"{'highway': 'residential', 'name': 'Carrer del Serralet'}"
"Carrer del Xipella"	"Carrer del Xipella"							"way"	" 207898645"		"{'highway': 'residential', 'name': 'Carrer del Xipella'}"
"Carrer dels Bous"	"Carrer dels Bous"							"way"	" 207894832"		"{'highway': 'living_street', 'name': 'Carrer dels Bous'}"
"Carrer dels Marxants"	"Carrer dels Marxants"							"way"	" 411099609"		"{'highway': 'living_street', 'name': 'Carrer dels Marxants'}"
"Carrer Major"	"Carrer Major"							"way"	" 751139942"		"{'highway': 'residential', 'name': 'Carrer Major'}"
"Carrer Major"	"Carrer Major"							"way"	" 207894816"		"{'highway': 'living_street', 'name': 'Carrer Major'}"
"Carrer Major"	"Carrer Major"							"way"	" 207894818"		"{'highway': 'living_street', 'name': 'Carrer Major'}"
"Parc de Bell-lloc"	"Parc de Bell-lloc"							"way"	" 207760419"		"{'landuse': 'village_green', 'name': 'Parc de Bell-lloc'}"
"Parc de Bombers Voluntaris de Santa Coloma de Queralt"	"Parc de Bombers Voluntaris de Santa Coloma de Queralt"							"way"	" 969543139"		"{'addr:postcode': '43420', 'addr:street': 'Carretera de Vallfogona', 'amenity': 'fire_station', 'building': 'industrial', 'building:levels': '2', 'name': 'Parc de Bombers Voluntaris de Santa Coloma de Queralt', 'nohousenumber': 'yes'}"
"Plaça de Catalunya"	"Plaça de Catalunya"							"way"	" 128503111"		"{'highway': 'secondary', 'junction': 'roundabout', 'lanes': '1', 'maxspeed': '50', 'name': 'Plaça de Catalunya', 'ref': 'C-241d'}"
"Plaça de Catalunya"	"Plaça de Catalunya"							"way"	" 710571662"		"{'highway': 'secondary', 'junction': 'roundabout', 'lanes': '1', 'maxspeed': '50', 'name': 'Plaça de Catalunya', 'ref': 'C-241d'}"
"Plaça de Catalunya"	"Plaça de Catalunya"							"way"	" 207762701"		"{'landuse': 'grass', 'name': 'Plaça de Catalunya'}"
"Plaça de l'Església"	"Plaça de l'Església"							"way"	" 411099615"		"{'highway': 'living_street', 'name': \"Plaça de l'Església\"}"
"Plaça de l'Església"	"Plaça de l'Església"							"way"	" 411099616"		"{'highway': 'living_street', 'name': \"Plaça de l'Església\"}"
"Plaça de l'Església"	"Plaça de l'Església"							"way"	" 751139943"		"{'highway': 'residential', 'name': \"Plaça de l'Església\"}"
"Plaça de l'Església"	"Plaça de l'Església"							"way"	" 411099614"		"{'highway': 'living_street', 'name': \"Plaça de l'Església\"}"
"Plaça de l'Església"	"Plaça de l'Església"							"way"	" 411099618"		"{'highway': 'living_street', 'name': \"Plaça de l'Església\"}"
"Plaça de la Llibertat"	"Plaça de la Llibertat"							"way"	" 207901734"		"{'highway': 'residential', 'name': 'Plaça de la Llibertat'}"
"Plaça de la Pau"	"Plaça de la Pau"							"relation"	"   6147931"		"{'area': 'yes', 'highway': 'pedestrian', 'name': 'Plaça de la Pau', 'type': 'multipolygon'}"
"Plaça de Sant Vicenç"	"Plaça de Sant Vicenç"							"way"	" 645349881"		"{'area': 'yes', 'highway': 'pedestrian', 'name': 'Plaça de Sant Vicenç'}"
"Plaça de Sant Vicenç"	"Plaça de Sant Vicenç"							"way"	" 411098385"		"{'area': 'yes', 'highway': 'pedestrian', 'name': 'Plaça de Sant Vicenç'}"
"Plaça de Sant Vicenç"	"Plaça de Sant Vicenç"							"way"	" 645349882"		"{'area': 'yes', 'highway': 'pedestrian', 'name': 'Plaça de Sant Vicenç'}"
"Plaça del Castell"	"Plaça del Castell"							"way"	" 224849057"		"{'highway': 'residential', 'name': 'Plaça del Castell'}"
"Plaça del Pati de la Font"	"Plaça del Pati de la Font"							"way"	" 411096839"		"{'highway': 'residential', 'name': 'Plaça del Pati de la Font', 'oneway': 'yes'}"
"Plaça del Pati de la Font"	"Plaça del Pati de la Font"							"way"	"1013714723"		"{'highway': 'residential', 'name': 'Plaça del Pati de la Font'}"
"Plaça del Pati de la Font"	"Plaça del Pati de la Font"							"way"	" 207896936"		"{'highway': 'residential', 'name': 'Plaça del Pati de la Font', 'oneway': 'yes'}"
"Plaça del Pati de la Font"	"Plaça del Pati de la Font"							"way"	" 207766359"		"{'highway': 'residential', 'name': 'Plaça del Pati de la Font', 'oneway': 'yes'}"
"Plaça del Portal"	"Plaça del Portal"							"way"	"  38131691"		"{'highway': 'residential', 'junction': 'roundabout', 'lanes': '1', 'name': 'Plaça del Portal', 'surface': 'paved'}"
"Plaça del Portalet"	"Plaça del Portalet"							"way"	" 207766364"		"{'highway': 'residential', 'name': 'Plaça del Portalet', 'oneway': 'yes', 'surface': 'paved'}"
"Plaça del Portalet"	"Plaça del Portalet"							"way"	" 411099610"		"{'highway': 'residential', 'name': 'Plaça del Portalet', 'oneway': 'no', 'surface': 'paved'}"
"Plaça del Pou"	"Plaça del Pou"							"way"	" 571407915"		"{'area': 'yes', 'highway': 'residential', 'name': 'Plaça del Pou'}"
"Plaça dels Fontanals"	"Plaça dels Fontanals"							"way"	" 207762702"		"{'area': 'yes', 'highway': 'pedestrian', 'name': 'Plaça dels Fontanals'}"
"Plaça dels Fontanals"	"Plaça dels Fontanals"							"way"	" 207764393"		"{'highway': 'residential', 'name': 'Plaça dels Fontanals'}"
"Plaça Major"	"Plaça Major"							"way"	" 207894840"		"{'area': 'yes', 'highway': 'living_street', 'name': 'Plaça Major'}"
"Plaça Major"	"Plaça Major"							"way"	" 207894838"		"{'highway': 'living_street', 'name': 'Plaça Major'}"
"Plaça Major"	"Plaça Major"							"way"	" 207894849"		"{'highway': 'living_street', 'name': 'Plaça Major'}"
"Plaça Major"	"Plaça Major"							"way"	" 207898642"		"{'highway': 'living_street', 'name': 'Plaça Major'}"
"Plaça Major"	"Plaça Major"							"way"	" 411099613"		"{'highway': 'living_street', 'name': 'Plaça Major'}"
"Plaça Major"	"Plaça Major"							"way"	" 411102504"		"{'highway': 'living_street', 'name': 'Plaça Major'}"
"Plaça Major"	"Plaça Major"							"way"	" 411102505"		"{'highway': 'living_street', 'name': 'Plaça Major'}"
"Plaça Major"	"Plaça Major"							"way"	" 411099612"		"{'highway': 'living_street', 'name': 'Plaça Major'}"
"Plaça Major"	"Plaça Major"							"way"	" 411102506"		"{'highway': 'living_street', 'name': 'Plaça Major'}"
"Plaça Major"	"Plaça Major"							"way"	" 224849055"		"{'highway': 'residential', 'name': 'Plaça Major'}"
