"# EDITED with R"	""	""	""	""	""	""	""	""	""	""	""
"name"	"name:ca"	"alt_name"	"alt_name:ca"	"translations"	"ca.wikipedia_page"	"wikidata_type"	"wikidata_id"	"typeOSM"	"idOSM"	"multilang_names"	"all_tags"
"Castell de les Pujades"	"Castell de les Pujades"							"way"	" 210555723"		"{'building': 'yes', 'historic': 'castle', 'name': 'Castell de les Pujades'}"
"Mas de la Pansa"	"Mas de la Pansa"							"node"	"1718413113"		"{'name': 'Mas de la Pansa', 'place': 'isolated_dwelling'}"
"Mas de les Valls"	"Mas de les Valls"							"node"	"1718413114"		"{'name': 'Mas de les Valls', 'place': 'isolated_dwelling'}"
"Mas Lluet de Dalt"	"Mas Lluet de Dalt"							"node"	"1718236233"		"{'name': 'Mas Lluet de Dalt', 'place': 'isolated_dwelling'}"
